[
  {
    "product_id": "prod_001",
    "merchant_id": "merchant_123",
    "name": "Classic Canvas Low-Top",
    "description": "Cotton canvas upper, vulcanized rubber sole, and a slim low-profile silhouette.",
    "price": 55.0,
    "currency": "USD",
    "category": "fashion",
    "image_url": "https://picsum.photos/seed/prod_001/400/300",
    "attributes": { "size": ["7", "8", "9", "10", "11", "12"], "color": ["white", "black", "navy"] },
    "availability": true
  },
  {
    "product_id": "prod_002",
    "merchant_id": "merchant_123",
    "name": "Everyday Leather Sneaker",
    "description": "Full-grain leather upper with a cushioned foam midsole for all-day wear.",
    "price": 95.0,
    "currency": "USD",
    "category": "fashion",
    "image_url": "https://picsum.photos/seed/prod_002/400/300",
    "attributes": { "size": ["7", "8", "9", "10", "11", "12"], "color": ["white", "tan", "black"] },
    "availability": true
  },
  {
    "product_id": "prod_003",
    "merchant_id": "merchant_123",
    "name": "Trail Running Shoe",
    "description": "Aggressive lugged outsole and a rock plate for technical, uneven terrain.",
    "price": 128.0,
    "currency": "USD",
    "category": "fashion",
    "image_url": "https://picsum.photos/seed/prod_003/400/300",
    "attributes": { "size": ["8", "9", "10", "11", "12"], "color": ["forest green", "charcoal", "clay"] },
    "availability": true
  },
  {
    "product_id": "prod_004",
    "merchant_id": "merchant_123",
    "name": "Road Running Shoe",
    "description": "Lightweight engineered mesh and a responsive EVA foam midsole for daily miles.",
    "price": 138.0,
    "currency": "USD",
    "category": "fashion",
    "image_url": "https://picsum.photos/seed/prod_004/400/300",
    "attributes": { "size": ["7", "8", "9", "10", "11", "12"], "color": ["blue", "black", "volt"] },
    "availability": true
  },
  {
    "product_id": "prod_005",
    "merchant_id": "merchant_123",
    "name": "Marathon Racing Flat",
    "description": "Carbon-plated race-day shoe at 6.4 oz with a propulsive rocker geometry.",
    "price": 155.0,
    "currency": "USD",
    "category": "fashion",
    "image_url": "https://picsum.photos/seed/prod_005/400/300",
    "attributes": { "size": ["8", "9", "10", "11"], "color": ["orange", "white"] },
    "availability": true
  },
  {
    "product_id": "prod_006",
    "merchant_id": "merchant_123",
    "name": "Suede Chukka Boot",
    "description": "Two-eyelet suede chukka on a natural crepe sole.",
    "price": 120.0,
    "currency": "USD",
    "category": "fashion",
    "image_url": "https://picsum.photos/seed/prod_006/400/300",
    "attributes": { "size": ["7", "8", "9", "10", "11", "12"], "color": ["sand", "dark brown", "grey"] },
    "availability": true
  },
  {
    "product_id": "prod_007",
    "merchant_id": "merchant_123",
    "name": "Waterproof Hiking Boot",
    "description": "Seam-sealed waterproof membrane, protective toe cap, and a grippy multi-terrain outsole.",
    "price": 159.0,
    "currency": "USD",
    "category": "fashion",
    "image_url": "https://picsum.photos/seed/prod_007/400/300",
    "attributes": { "size": ["8", "9", "10", "11", "12"], "color": ["brown", "black"] },
    "availability": true
  },
  {
    "product_id": "prod_008",
    "merchant_id": "merchant_123",
    "name": "Chelsea Boot",
    "description": "Elastic-gore leather Chelsea boot with a stacked leather heel.",
    "price": 135.0,
    "currency": "USD",
    "category": "fashion",
    "image_url": "https://picsum.photos/seed/prod_008/400/300",
    "attributes": { "size": ["7", "8", "9", "10", "11", "12"], "color": ["black", "chestnut"] },
    "availability": false
  },
  {
    "product_id": "prod_009",
    "merchant_id": "merchant_123",
    "name": "Penny Loafer",
    "description": "Hand-stitched moc-toe penny loafer in polished calf leather.",
    "price": 110.0,
    "currency": "USD",
    "category": "fashion",
    "image_url": "https://picsum.photos/seed/prod_009/400/300",
    "attributes": { "size": ["7", "8", "9", "10", "11", "12"], "color": ["burgundy", "black", "brown"] },
    "availability": true
  },
  {
    "product_id": "prod_010",
    "merchant_id": "merchant_123",
    "name": "Driving Moccasin",
    "description": "Soft deerskin upper with a rubber-nub sole for grip behind the wheel.",
    "price": 98.0,
    "currency": "USD",
    "category": "fashion",
    "image_url": "https://picsum.photos/seed/prod_010/400/300",
    "attributes": { "size": ["7", "8", "9", "10", "11", "12"], "color": ["navy", "tan", "grey"] },
    "availability": true
  },
  {
    "product_id": "prod_011",
    "merchant_id": "merchant_123",
    "name": "Cap-Toe Oxford",
    "description": "Closed-lacing cap-toe oxford with a Goodyear-welted leather sole.",
    "price": 145.0,
    "currency": "USD",
    "category": "fashion",
    "image_url": "https://picsum.photos/seed/prod_011/400/300",
    "attributes": { "size": ["7", "8", "9", "10", "11", "12"], "color": ["black", "oxblood"] },
    "availability": true
  },
  {
    "product_id": "prod_012",
    "merchant_id": "merchant_123",
    "name": "Double Monk Strap",
    "description": "Two-buckle monk strap in burnished calfskin.",
    "price": 150.0,
    "currency": "USD",
    "category": "fashion",
    "image_url": "https://picsum.photos/seed/prod_012/400/300",
    "attributes": { "size": ["7", "8", "9", "10", "11", "12"], "color": ["dark brown", "black"] },
    "availability": true
  },
  {
    "product_id": "prod_013",
    "merchant_id": "merchant_123",
    "name": "Leather Footbed Sandal",
    "description": "Adjustable triple-strap sandal on a contoured vegetable-tanned leather footbed.",
    "price": 65.0,
    "currency": "USD",
    "category": "fashion",
    "image_url": "https://picsum.photos/seed/prod_013/400/300",
    "attributes": { "size": ["6", "7", "8", "9", "10", "11"], "color": ["tan", "black", "white"] },
    "availability": true
  },
  {
    "product_id": "prod_014",
    "merchant_id": "merchant_123",
    "name": "Sport Slide",
    "description": "Contoured EVA slide with a quick-dry footbed.",
    "price": 35.0,
    "currency": "USD",
    "category": "fashion",
    "image_url": "https://picsum.photos/seed/prod_014/400/300",
    "attributes": { "size": ["7", "8", "9", "10", "11", "12"], "color": ["black", "blue", "red"] },
    "availability": true
  },
  {
    "product_id": "prod_015",
    "merchant_id": "merchant_123",
    "name": "Block Heel Ankle Boot",
    "description": "50mm block-heel ankle boot with an inside zip and almond toe.",
    "price": 125.0,
    "currency": "USD",
    "category": "fashion",
    "image_url": "https://picsum.photos/seed/prod_015/400/300",
    "attributes": { "size": ["5", "6", "7", "8", "9", "10"], "color": ["black", "taupe", "cognac"] },
    "availability": true
  },
  {
    "product_id": "prod_016",
    "merchant_id": "merchant_123",
    "name": "Almond-Toe Ballet Flat",
    "description": "Ballet flat with a padded collar and a flexible split sole.",
    "price": 72.0,
    "currency": "USD",
    "category": "fashion",
    "image_url": "https://picsum.photos/seed/prod_016/400/300",
    "attributes": { "size": ["5", "6", "7", "8", "9", "10"], "color": ["blush", "black", "leopard"] },
    "availability": true
  },
  {
    "product_id": "prod_017",
    "merchant_id": "merchant_123",
    "name": "Merino Wool Slip-On",
    "description": "Machine-washable merino wool upper slip-on with a lightweight foam sole.",
    "price": 85.0,
    "currency": "USD",
    "category": "fashion",
    "image_url": "https://picsum.photos/seed/prod_017/400/300",
    "attributes": { "size": ["6", "7", "8", "9", "10", "11", "12"], "color": ["heather grey", "navy", "natural"] },
    "availability": true
  },
  {
    "product_id": "prod_018",
    "merchant_id": "merchant_123",
    "name": "Insulated Winter Boot",
    "description": "Fleece-lined, weatherproof winter boot rated to -25 degrees Fahrenheit.",
    "price": 148.0,
    "currency": "USD",
    "category": "fashion",
    "image_url": "https://picsum.photos/seed/prod_018/400/300",
    "attributes": { "size": ["8", "9", "10", "11", "12"], "color": ["black", "brown"] },
    "availability": true
  }
]
